,name,quote,auth_id
1258,Бродский,"Губят тебя твои же концептуальные и аналитические замашки, например, когда при помощи языка анатомируешь свой опыт и тем лишаешь сознание всех благ интуиции.",9.0
1259,Бродский,"Что-то в их лицах есть,
что противно уму.
Что выражает лесть
неизвестно кому.",9.0
1260,Бродский,"Здесь, на земле,
от нежности до умоисступленья
все формы жизни есть приспособленье.",9.0
1261,Бродский,"Мир одеял разрушен сном.
Но в чьем-то напряженном взоре
маячит в сумраке ночном
окном разрезанное море.",9.0
1262,Бродский,"… в целом отношения между реальностью и произведением искусства далеко не такие близкие, как уверяют нас критики. Можно пережить бомбардировку Хиросимы или просидеть четверть века в лагере и ничего не произвести, тогда как одна бессонная ночь может дать жизнь бессмертному стихотворению. Будь взаимодействие между пережитым и искусством таким тесным, как нам вбивали в голову начиная с Аристотеля и дальше, у нас в наличии было бы сейчас гораздо больше — как в количественном, так и в качественном отношении — искусства, чем мы имеем. При всём многообразии и в особенности ужасах пережитого в двадцатом веке большая часть содержимого наших полок просится в макулатуру.",9.0
1263,Бродский,"Многие — собственно, все! — в этом, по крайней мере,
мире стоят любви…",9.0
1264,Бродский,"Это трудное время. Мы должны пережить, перегнать эти годы,
С каждым новым страданьем забывая былые невзгоды,
И встречая, как новость, эти раны и боль поминутно,
Беспокойно вступая в туманное новое утро.",9.0
1265,Бродский,"И вся-то жизнь — биенье сердца,
И говор фраз, да плеск вины,
И ночь под лодочкою секса
По слабой речке тишины.",9.0
1266,Бродский,Трагедия — это когда я порезал себе палец. Комедия — когда вы провалились в открытый канализационный люк и сломали себе шею.,9.0
1267,Бродский,"Если президенты не могут делать этого со своими женами, они делают это со своими странами.",9.0
1268,Бродский,"Если много мужчин собираются вместе, это, скорее всего, война.",9.0
1269,Бродский,"Ты это – я; потому что кого же мы любим, как не себя?",9.0
1270,Бродский,"Видимо, земля воистину кругла, раз ты приходишь туда, где нету ничего, помимо воспоминаний.",9.0
1271,Бродский,Жизнь на три четверти — узнавание Себя в нечленораздельном вопле.,9.0
1272,Горький,"Без любви жить человеку невозможно: затем ему и душа дана, чтобы он мог любить.",10.0
1273,Горький,В жизни всегда есть место подвигам. ,10.0
1274,Горький,"Если все время человеку говорить, что он «свинья», то он действительно в конце концов захрюкает.",10.0
1275,Горький,"Атеистическое наше время, усмехаясь над библейской легендой, считает, что Бог — это псевдоним человеческой глупости.",10.0
1276,Горький,"До той поры, пока мы не научимся любоваться человеком, как самым красивым и чудесным явлением на нашей планете, до той поры мы не освободимся от мерзости и лжи нашей жизни.",10.0
1277,Горький,"Я всегда презирал людей, которые слишком заботятся о том, чтобы быть сытыми. ",10.0
1278,Горький,"Восславим женщину-Мать, чья любовь не знает преград, чьей грудью вскормлен весь мир!",10.0
1279,Горький,Нет людей чисто беленьких или совершенно черненьких; люди все пестрые.,10.0
1280,Горький,Доказывать человеку необходимость знания — это все равно что убеждать его в полезности зрения.,10.0
1281,Горький,"В каждом человеке скрыта мудрая сила строителя, и нужно ей дать волю развиться и расцвести.",10.0
1282,Горький,"Жизнь идет: кто не поспевает за ней, тот остается одиноким.",10.0
1283,Горький,"Не умея держать в руке топор — дерева не отешешь, а не зная языка хорошо — красиво и всем понятно — не напишешь.",10.0
1284,Горький,Безумство храбрых — вот мудрость жизни!,10.0
1285,Горький,"Жизнь всегда будет достаточно плоха для того, чтоб желание лучшего не угасало в человеке.",10.0
1286,Горький,Женщина иногда может в своего мужа влюбиться.,10.0
1287,Горький,"Когда природа лишила человека его способности ходить на четвереньках, она дала ему в виде посоха — идеал! И с той поры он бессознательно стремится к лучшему — все выше!",10.0
1288,Горький,"Когда труд — удовольствие, жизнь — хороша! Когда труд — обязанность, жизнь — рабство!",10.0
1289,Горький,Есть только две формы жизни: гниение и горение.,10.0
1290,Горький,"Да не о том думай, что спросили, а о том — для чего? Догадаешься — для чего, тогда и поймешь, как надо ответить.",10.0
1291,Горький,"Память, этот бич несчастных, оживляет даже камни прошлого и даже в яд, выпитый некогда, подливает капли меда.",10.0
1292,Горький,Высота культуры определяется отношением к женщине.,10.0
1293,Горький,Мышление афоризмами характерно для народа…,10.0
1294,Горький,"Все относительно на этом свете, и нет в нем для человека такого положения, хуже которого не могло бы ничего быть.",10.0
1295,Горький,"Талант — как породистый конь, необходимо научиться управлять им, а если дергать повода во все стороны, конь превратится в клячу.",10.0
1296,Горький,На день надо смотреть как на маленькую жизнь.,10.0
1297,Горький,"Как можно не верить человеку? Даже если и видишь — врет он, верь ему, то есть слушай и старайся понять, почему он врет?",10.0
1298,Горький,От любви к женщине родилось все прекрасное на земле.,10.0
1299,Горький,"История человеческого труда и творчества гораздо интереснее и значительнее истории человека, — человек умирает, не прожив и сотни лет, а дело его живет века.",10.0
1300,Горький,"Около хорошего человека потрешься, как медная копейка о серебро, и сам потом за двугривенный сойдешь.",10.0
1301,Горький,Наиболее деятельным союзником болезни является уныние больного.,10.0
1302,Горький,"Человек есть вселенная, и да здравствует вовеки он, носящий в себе весь мир.",10.0
1303,Горький,"Любите книгу, она облегчает вам жизнь, дружески поможет разобраться в пестрой и бурной путанице мыслей, чувств, событий, она научит вас уважать человека и самих себя, она окрыляет ум и сердце чувством любви к миру, к человечеству.",10.0
1304,Горький,"Труд ученого — достояние всего человечества, и наука является областью наибольшего бескорыстия.",10.0
1305,Горький,"…Талант — это вера в себя, в свою силу…",10.0
1306,Горький,"Талант развивается из чувства любви к делу, возможно даже, что талант — в сущности его — и есть любовь к делу, к процессу работы.",10.0
1307,Горький,Человека приласкать — никогда не вредно.,10.0
1308,Горький,Хорошее всегда зажигает желание лучшего.,10.0
1309,Горький,Люди запутываются в массе лишних слов.,10.0
1310,Горький,"Учитесь у всех, не подражайте никому.",10.0
1311,Горький,"Истинная любовь бьет сердце, как молния, и нема, как молния.",10.0
1312,Горький,"Ум имей хоть маленький, да свой.",10.0
1313,Горький,"Люди, которых понимаешь сразу, люди без остатка — неинтересны. Человек должен вмещать в себя, по возможности, все, плюс — еще нечто.",10.0
1314,Горький,"Ум есть драгоценный камень, который более красиво играет в оправе скромности.",10.0
1315,Горький,"Истина необходима человеку так же, как слепому трезвый поводырь.",10.0
1316,Горький,"Я как-то особенно люблю солнце, мне нравится самое имя его, сладкие звуки имени, звон, скрытый в них.",10.0
1317,Горький,"Жизнь устроена так дьявольски искусно, что, не умея ненавидеть, невозможно искренне любить.",10.0
1318,Горький,"Я знаю, что война — сплошное зверство и что на войне люди, ни в чем не повинные друг перед другом, истребляют друг друга, будучи насильно поставлены в состояние самообороны.",10.0
1319,Горький,"Мучительны сердца скорби, И часто помочь ему нечем, — Тогда мы забавной шуткой боль сердца успешно лечим!",10.0
1320,Горький,"Черти в аду мучительно завидуют, наблюдая иезуитскую ловкость, с которой люди умеют порочить друг друга.",10.0
1321,Горький,"Один, если он и велик, все-таки мал.",10.0
1322,Горький,"Нужно читать и уважать только те книги, которые учат понимать смысл жизни, понимать желания людей и истинные мотивы их поступков.",10.0
1323,Горький,"Счастье начинается с ненависти к несчастью, с физиологической брезгливости ко всему, что искажает, уродует человека, с внутреннего органического отталкивания от всего, что ноет, стонет, вздыхает…",10.0
1324,Горький,"Стремление вперед — вот цель жизни. Пусть же вся жизнь будет стремлением, и тогда в ней будут высоко прекрасные часы.",10.0
1325,Горький,Рожденный ползать — летать не может!,10.0
1326,Горький,"Решающую роль в работе играет не всегда материал, но всегда мастер.",10.0
1327,Горький,"Разум, не организованный идеей, — еще не та сила, которая входит в жизнь творчески.",10.0
1328,Горький,"Прославим поэтов, у которых один бог — красиво сказанное, бесстрашное слово правды.",10.0
1329,Горький,"Не будьте равнодушны, ибо равнодушие смертоносно для души человека.",10.0
1330,Горький,Предрассудки — обломки старых истин.,10.0
1331,Горький,"Книги читай, однако помни — книга книгой, а своим мозгом двигай!",10.0
1332,Горький,"Помнить — это все равно что понимать, а чем больше понимаешь, тем более видишь хорошего.",10.0
1333,Горький,…Страшно хорошо — быть рожденным с солнцем в крови!,10.0
1334,Горький,"Всякая работа трудна до времени, пока ее не полюбишь, а потом — она возбуждает и становится легче.",10.0
1335,Горький,"Смысл жизни в красоте и силе стремления к целям, и нужно, чтобы каждый момент бытия имел свою высокую цель.",10.0
1336,Горький,"Если враг не сдаётся, его уничтожают. ",10.0
1337,Горький,…Ссориться — не значит не любить.,10.0
1338,Горький," …Погибает тот, кто должен погибнуть, чью гибель жалость не предотвратит. Кто не может жить для жизни, не нужно, не стоит жалеть о его смерти.",10.0
1339,Горький,"Есть любовь, которая мешает человеку жить.",10.0
1340,Горький,Литература — дело глубоко ответственное и не требует кокетства дарованиями.,10.0
1341,Горький,"Росту человеческих потребностей нет предела… Человек никогда не будет доволен, никогда, и это его лучшее качество.",10.0
1342,Горький,"Книга — такое же явление жизни, как человек, она — тоже факт живой, говорящий, и она менее «вещь», чем все другие вещи, созданные и создаваемые человеком.",10.0
1343,Горький,"Лучшее наслаждение, самая высокая радость в жизни — чувствовать себя нужным и близким людям!",10.0
1344,Горький,"Смысл жизни вижу в творчестве, а творчество самодовлеет и безгранично!",10.0
1345,Горький,"Нужно жить всегда влюбленным во что-нибудь недоступное тебе. Человек становится выше ростом от того, что тянется вверх.",10.0
1346,Горький,"Краше солнца — нету в мире бога, нет огня, огня любви чудесней.",10.0
1347,Горький,Подлецы — самые строгие судьи.,10.0
1348,Горький,"Когда человеку лежать на одном боку неудобно — он перевертывается на другой, а когда ему жить неудобно — он только жалуется. А ты сделай усилие: перевернись!",10.0
1349,Горький,"Не зная прошлого, невозможно понять подлинный смысл настоящего и цели будущего.",10.0
1350,Горький,"Но то, чего женщина хочет, — Сам Бог не ведает даже!",10.0
1351,Горький,Чтобы иметь право критиковать — надо верить в какую-то истину. ,10.0
1352,Горький,"Никогда не подходи к человеку, думая, что в нем больше дурного, чем хорошего…",10.0
1353,Горький,Все слова рождены деянием. ,10.0
1354,Горький,Без совести и при большом уме не проживешь. ,10.0
1355,Горький,"Время — враг людей, которые любят спокойную жизнь. ",10.0
1356,Горький,Любовь — это желание жить. ,10.0
1357,Горький,Дети — это завтрашние судьи наши. ,10.0
1358,Горький,От человека остаются только одни его дела. ,10.0
1359,Горький,Хороший смех — верный признак духовного здоровья. ,10.0
1360,Горький,Самолюбие — худший вид зависимости. ,10.0
1361,Горький,"Учитель, если он честен, всегда должен быть внимательным учеником. ",10.0
1362,Горький,"Что человек на Руси ни делает, все равно его жалко. ",10.0
1363,Горький,"Книги читай, однако помни — книга книгой, а своим мозгом двигай. ",10.0
1364,Горький,Личный эгоизм — это родный отец подлости. ,10.0
1365,Горький,Все люди делом живы. ,10.0
1366,Горький,Доброта — она превыше всех благ. ,10.0
1367,Горький,"За все, что человек берет, он платит собой.",10.0
1368,Горький,"Маленький человек, когда он хочет работать, непобедимая сила. ",10.0
1369,Горький,В совершенствовании человека — смысл жизни. ,10.0
1370,Горький,В карете прошлого никуда не уедешь. ,10.0
1371,Горький,Не пишите на чистых страницах вашего сердца чужими словами.,10.0
1372,Горький,"День — это маленькая жизнь, и надо прожить ее так, будто ты должен умереть сейчас, а тебе неожиданно подарили еще сутки.",10.0
1373,Горький,"Жизнь надо мешать чаще, чтобы она не закисала.",10.0
1374,Горький,"Иногда после разговора с человеком хочется дружелюбно пожать лапу собаке, улыбнуться обезьяне, поклониться слону.",10.0
1375,Горький,"Жизнь без любви — не жизнь, а существование. Для того и дана душа человеку, чтобы любить…",10.0
1376,Горький,"Иногда для того, чтобы хорошо видеть, необходимо именно отойти, а не приблизиться.",10.0
1377,Горький,"Язык — это оружие литератора, как ружьё — солдата. Чем лучше оружие — тем сильнее воин. ",10.0
1378,Горький,Красота и мудрость — в простоте.,10.0
1379,Горький,Мало сказать: не делай так. Надо ещё прибавить: вот так делай.,10.0
1380,Горький,"Болезнь врача всегда тяжелее болезни его пациентов; пациент только чувствует, а врач ещё и знает кое-что о том, как разрушается его организм. Это один из тех случаев, когда знание можно считать приближающим смерть.",10.0
1381,Горький,"Когда человек хочет узнать — он исследует, когда он хочет спрятаться от тревог жизни — он выдумывает.",10.0
1382,Горький,"Если вам хочется похвалить кого-то — сделайте это немедленно, а если поругать — отложите до завтра: возможно, вы сочтете, что этого делать не стоит.",10.0
1383,Горький,"Прошлое не безупречно, но упрекать его бессмысленно, а вот изучать полезно.",10.0
1384,Горький,"Я люблю книги: каждая из них мне кажется чудом, а писатель — магом.",10.0
1385,Горький,"Основная задача всех церквей была одна и та же: внушать бедным холопам, что для них — нет счастья на земле, оно уготовано для них на небесах, и что каторжный труд на чужого дядю — дело богоугодное.",10.0
1386,Горький,"Жизнь создаётся медленно и трудно, а разрушается быстро и легко.",10.0
1387,Горький,"Если ты хочешь, чтобы вокруг тебя были хорошие, добрые люди, — попробуй относиться к ним внимательно, ласково, вежливо — увидишь, что все станут лучше. Все в жизни зависит от тебя самого, поверь мне.",10.0
1388,Горький,"Человек, который считает свою зубную боль несчастием всего мира, — явно склонен преувеличивать события.",10.0
1389,Горький,Всем хорошим во мне я обязан книгам.,10.0
1390,Горький,"В простоте слова — самая великая мудрость, пословицы и песни всегда кратки, а ума и чувства вложено в них на целые книги.",10.0
1391,Горький,"…не сердитесь на дураков, они будут жить еще долго, к ним следует относиться, как к дурной погоде.",10.0
1392,Горький,Нужно уметь извлекать из факта смысл.,10.0
1393,Горький,"Знать необходимо не затем, чтоб только знать, но для того, чтоб научиться делать.",10.0
1394,Горький,…для человека нет и не может быть ничего ближе человека.,10.0
1395,Горький,"Учить детей — дело необходимое, следует понять, что весьма полезно и нам учиться у детей.",10.0
