,name,quote,auth_id
864,Шекспир,"Три правила достижения успеха: знать больше, чем остальные; работать больше, чем остальные; ожидать меньше, чем остальные.",7.0
865,Шекспир,"Если смерти серп неумолим, оставь потомков, чтобы спорить с ним! ",7.0
866,Шекспир,И хорошие доводы должны уступать лучшим. ,7.0
867,Шекспир,"Бедное раздавленное насекомое страдает так же, как умирающий гигант.",7.0
868,Шекспир,"Настоящий друг везде верен, в счастье и в беде. ",7.0
869,Шекспир,"Честь девушки — все ее богатство, оно дороже всякого наследства. ",7.0
870,Шекспир,"Трус умирает при каждой опасности, грозящей ему, храброго же смерть настигает только раз.",7.0
871,Шекспир,"Интрига составляет силу слабых, даже у дураков хватает ума, чтобы вредить.",7.0
872,Шекспир,"Самопочитание никогда не бывает столь мерзостно, как самоунижение. ",7.0
873,Шекспир,"Одним взглядом можно убить любовь, одним же взглядом можно воскресить её.",7.0
874,Шекспир,"Влюбиться можно в красоту, но полюбить – лишь только душу.",7.0
875,Шекспир,"Ворона грязью перемажет крылья —
Никто и не заметит всё равно,
А лебедь, несмотря на все усилья,
Отмыть не сможет с белизны пятно…",7.0
876,Шекспир,У каждого безумия есть своя логика.,7.0
877,Шекспир,Совет друга — лучшая опора против врагов. ,7.0
878,Шекспир,"Что значит имя? Роза пахнет розой, хоть розой назови ее, хоть нет.",7.0
879,Шекспир,"Доброта в женщине, а не соблазнительные взоры завоюют мою любовь. ",7.0
880,Шекспир,"Успех острого слова зависит более от уха слушающего, чем от языка говорящего.",7.0
881,Шекспир,"Любовь придает благородство даже и тем, которым природа отказала в нем. ",7.0
882,Шекспир,"Не слишком разжигайте печь для своих врагов, иначе вы сгорите в ней сами.",7.0
883,Шекспир,"Иногда мы и в самой потере находим утешение, а иногда и самое приобретение горько оплакиваем. ",7.0
884,Шекспир,"Надежда на наслаждение почти так же приятна, как и само наслаждение.",7.0
885,Шекспир,Слова любви немеют при разлуке. ,7.0
886,Шекспир,"Мужчины похожи на апрель, когда ухаживают, и на декабрь, когда уже женаты.",7.0
887,Шекспир,"Истинная любовь не может говорить, потому что истинное чувство выражается скорее делом, чем словами. ",7.0
888,Шекспир,"Большинство людей предпочитают глупость мудрости, ибо глупость смешит, а мудрость печалит.",7.0
889,Шекспир,Вы посмотрите на моих детей. Моя былая свежесть в них жива. В них оправданье старости моей. ,7.0
890,Шекспир,"Чтобы поймать счастье, надо уметь бегать.",7.0
891,Шекспир,"Краткость есть душа ума, а многословье — бренные прикрасы. ",7.0
892,Шекспир,"Глупость и мудрость с такой же легкостью схватываются, как и заразные болезни. Поэтому выбирай себе товарищей.",7.0
893,Шекспир,"Когда дружба начинает слабеть и охлаждаться, она всегда прибегает к усиленной вежливости. ",7.0
894,Шекспир,"Любовь бежит от тех, кто гонится за нею, а тем, кто прочь бежит, кидается на шею.",7.0
895,Шекспир,Не давай языка необдуманным мыслям и никакой необдуманной мысли не приводи в исполнение. ,7.0
896,Шекспир,"Где мало слов, там вес они имеют.",7.0
897,Шекспир,Из всех низких чувств страх — самое низкое. ,7.0
898,Шекспир,"Природа-мать мудра, да сын безмозглый.",7.0
899,Шекспир,Гнилое не терпит прикосновения. ,7.0
900,Шекспир,"Клятвы, данные в бурю, забываются в тихую погоду.",7.0
901,Шекспир,"Хорошие ноги рано или поздно станут спотыкаться; гордая спина согнется; черная борода поседеет; кудрявая голова облысеет; прекрасное лицо покроется морщинами; глубокий взор потускнеет; но доброе сердце подобно солнцу и луне; и даже скорее солнцу, чем луне; ибо оно сияет ярким светом, никогда не изменяется и всегда следует верным путем. ",7.0
902,Шекспир,"Мы раздражаемся по пустякам, когда задеты чем-нибудь серьезным.",7.0
903,Шекспир,"Что человек, когда он занят только сном и едой? Животное, не больше. ",7.0
904,Шекспир,"Так сладок мед, что, наконец, он горек. Избыток вкуса убивает вкус.",7.0
905,Шекспир,"Следуй голосу ума, а не гнева. ",7.0
906,Шекспир,"Совсем не знак бездушья – молчаливость. Гремит лишь то, что пусто изнутри.",7.0
907,Шекспир,Большое горе врачует меньшее. ,7.0
908,Шекспир,"Наша личность — это сад, а наша воля — его садовник. ",7.0
909,Шекспир,"Бедна любовь, если ее можно измерить. ",7.0
910,Шекспир,"Не вдавайтесь и в извинениях в такие же крайности, как в оскорблениях. ",7.0
911,Шекспир,"Чтоб оценить чье-нибудь качество, надо иметь некоторую долю этого качества и в самом себе. ",7.0
912,Шекспир,"Горе налегает сильнее, если заметит, что ему поддаются. ",7.0
913,Шекспир,Время идет для разных лиц различно. ,7.0
914,Шекспир,"Если бы не было разума, нас заездила бы чувственность. На то и ум, чтобы обуздывать ее нелепости. ",7.0
915,Шекспир,"Любовь — над бурей поднятый маяк, / Не меркнущий во мраке и тумане, / Любовь — звезда, которою моряк / Определяет место в океане. ",7.0
916,Шекспир,"Глупость и мудрость с такой же легкостью схватываются, как и заразные болезни. Поэтому выбирай себе товарищей. ",7.0
917,Шекспир,Люди — хозяева своей судьбы. ,7.0
918,Шекспир,Легкое сердце живет долго. ,7.0
919,Шекспир,"Не хватайся за колесо, когда оно вниз катится: шею сломишь понапрасну. Вот если оно вверх идет, держись за него: сам наверху будешь. ",7.0
920,Шекспир,"Слова — ветер, а бранные слова — сквозняк, который вреден",7.0
921,Шекспир,"Сомнения — предатели: заставляя бояться попытки, они лишают нас и того добра, которое часто мы могли бы приобрести. ",7.0
922,Шекспир,"Небольшие жеманные стихотворения раздражают нервы больше, нежели скрип немазаных колес. ",7.0
923,Шекспир,Любовь сильнее страха смерти. ,7.0
924,Шекспир,Разумный глупец лучше глупого мудреца. ,7.0
925,Шекспир,"Ребячество — плакать от боязни того, что неизбежно. ",7.0
926,Шекспир,"Величайшая обида, какую можно причинить честному человеку, — это заподозрить его в нечестном. ",7.0
927,Шекспир,"Гнусному и доброта, и мудрость кажутся гнусными; грязи — только грязь по вкусу. ",7.0
928,Шекспир,Только настоящий друг может терпеть слабости своего друга.,7.0
929,Шекспир,"Трудно запугать сердце, ничем не запятнанное. ",7.0
930,Шекспир,"Увлекшись ревнивой подозрительностью, можно оскорбить и совершенно невинного человека. ",7.0
931,Шекспир,"Благословенны миротворцы на земле. Люби всех, доверяй избранным, не делай зла никому. ",7.0
932,Шекспир,Моя честь — это моя жизнь; обе растут из одного корня. Отнимите у меня честь — и моей жизни придет конец. ,7.0
933,Шекспир,"Если бы острое слово оставляло следы, мы бы все ходили перепачканные. ",7.0
934,Шекспир,"Видеть и чувствовать — это быть, размышлять, жить. ",7.0
935,Шекспир,Здоровье — дороже золота. ,7.0
936,Шекспир,Истина любит действовать открыто. ,7.0
937,Шекспир,"Работа, которую мы делаем охотно, исцеляет боли. ",7.0
938,Шекспир,"Излишняя торопливость, точно так же как и медлительность, ведет к печальному концу. ",7.0
939,Шекспир,"Внешняя красота еще драгоценнее, когда прикрывает внутреннюю. Книга, золотые застежки которой замыкают золотое содержание, приобретает особенное уважение. ",7.0
940,Шекспир,"Ни один порок не настолько прост, чтобы не принимать с внешней стороны вид добродетели. ",7.0
941,Шекспир,"Ты будешь жить на свете десять раз, десятикратно в детях повторенный, и вправе будешь в свой последний час торжествовать над смертью покоренной. ",7.0
942,Шекспир,"Земля, природы мать, — ее же и могила: что породила, то и схоронила. ",7.0
943,Шекспир,"Ничто не бывает постоянно одинаково хорошим, потому что и хорошее, делаясь чересчур уж полнокровным, умрет от своего же переизбытка. ",7.0
944,Шекспир,"Опасна власть, когда с ней совесть в ссоре.",7.0
945,Шекспир,"Ревность — чудовище, само себя и зачинающее, и рождающее.",7.0
946,Шекспир,Всякое препятствие любви только усиливает ее. ,7.0
947,Шекспир,Кому не хватает решительной воли — не хватает ума. ,7.0
948,Шекспир,Время — мать и кормилица всего хорошего. ,7.0
949,Шекспир,Желание — отец мысли. ,7.0
950,Шекспир,В уме нечутком не место шуткам. ,7.0
951,Шекспир,"Будь со всеми обходителен, но никак не запанибрата. ",7.0
952,Шекспир,Молодости свойственно грешить поспешностью. ,7.0
953,Шекспир,"Все влюбленные клянутся исполнить больше, чем могут, и не исполняют даже возможного. ",7.0
954,Шекспир,"Общая участь всех хвастунов: рано ли, поздно ли, а все-таки непременно попадешь впросак. ",7.0
955,Шекспир,"А вот похоть вино и вызывает и отшибает, вызывает желание, но препятствует удовлетворению. Поэтому добрая выпивка, можно сказать, только и делает, что с распутством душой кривит: возбудит и обессилит, разожжет и погасит, раздразнит и обманет, поднимет, а стоять не дает. ",7.0
956,Шекспир,"Ревнивцы не нуждаются в поводе: они часто ревнуют совсем не по поводу, а потому, что ревнивы. ",7.0
957,Шекспир,Страх — всегдашний спутник неправды. ,7.0
958,Шекспир,"Излишняя забота — такое же проклятье стариков, как беззаботность — горе молодежи. ",7.0
959,Шекспир,"Лучше зажечь одну свечу, чем вечно проклинать темноту.",7.0
960,Шекспир,Сомнение в своем достоинстве — это малодушное самоуничтожение.,7.0
961,Шекспир,"Во всяком деле, чтобы добиться успеха, нужна некоторая доля безумия.",7.0
962,Шекспир,"Безумна до того любовь моя, что зла в тебе не замечаю я.",7.0
963,Шекспир,"Чем лучше цель, тем целимся мы метче.",7.0
964,Шекспир,"Никто не хорош настолько, чтобы учить других.",7.0
965,Шекспир,Убитых словом добивают молчанием.,7.0
966,Шекспир,"Мы знаем, кто мы есть, но не знаем, кем мы можем быть.",7.0
967,Шекспир,Ничто не вечно под луной.,7.0
968,Шекспир,"Чем страсть сильнее, тем печальней бывает у нее конец.",7.0
969,Шекспир,У всякого безумия есть своя логика.,7.0
970,Шекспир,Музыка глушит печаль.,7.0
971,Шекспир,"Nothing is really good or bad in itself — it’s all what a person thinks about it.
Дурное и хорошее — их нет. Есть то, как мы решим назвать их сами.
(Нет ничего, что было бы хорошим иль дурным — но делает его сознанье таковым.)",7.0
972,Шекспир,Слёзы — оружие женщин.,7.0
973,Шекспир,Самое распространённое желание – отличаться от других.,7.0
974,Шекспир,Любовь с рассудком редко живет в ладу.,7.0
975,Шекспир,"В своём несчастье одному я рад, —
Что ты — мой грех, и ты — мой вечный ад…",7.0
976,Шекспир,"Не вечная ли это насмешка любви, что женщина не может любить того, кто любит её?",7.0
977,Шекспир,Мы сотканы из ткани наших снов.,7.0
978,Шекспир,"«Я ненавижу», — но тотчас
Она добавила: «Не вас!»",7.0
979,Шекспир,"Разбойник требует: кошелек — или жизнь. Врач отнимает и кошелек, и жизнь.",7.0
980,Шекспир,"Одна судьба у наших двух сердец:
Замрёт моё — и твоему конец!",7.0
981,Шекспир,"В жизни всё повторяется дважды, но в виде драмы только однажды, а во второй раз насмешки вроде бы, в виде пародии, только пародии.",7.0
982,Шекспир,Лаской лжец умеет прикрываться.,7.0
983,Шекспир,Боязливая и мечтательная нерешительность ползёт за ленью и влечёт за собой бессилие и нищету.,7.0
984,Шекспир,Дурацкий колпак мозгов не портит.,7.0
985,Шекспир,"Ты не со мной — и день покрыла мгла;
придешь во сне — и ночь, как день, светла.",7.0
986,Шекспир,"Я всё простил, что испытал когда-то,
И ты прости, – взаимная расплата.",7.0
987,Шекспир,"Самолюбие не так заслуживает осуждения, как недостаток самоуважения.",7.0
988,Шекспир,Сон — бальзам природы.,7.0
989,Шекспир,"Когда достойна ты любви моей,
Достоин я взаимности твоей.",7.0
990,Шекспир,Истинная честность живет часто как жемчужина в грязной устричной раковине.,7.0
991,Шекспир,"Если у вас есть слезы, приготовьтесь пролить их.",7.0
992,Шекспир,"Все люди грешны, всеми правит грех.
(Все люди скверны и в своей скверне торжествуют.)",7.0
993,Шекспир,Краткость — душа остроумия.,7.0
994,Шекспир,"Кто предаёт себя же самого —
Не любит в этом мире никого!",7.0
995,Шекспир,Пусть порицают тебя за молчание — не бранили бы только за говорливость.,7.0
996,Шекспир,Бедная мудрость часто бывает рабой богатой глупости.,7.0
997,Шекспир,"Кто знал в любви паденья и подъёмы,
Тому глубины совести знакомы.",7.0
998,Шекспир,"Всем существом моим сроднился я с тобой!
Мир без тебя — ничто, окутанное тьмой.",7.0
999,Шекспир,"Унынье — не лекарство, горький яд, когда поправить дело невозможно…",7.0
1000,Шекспир,Путём зла не доходят до добра.,7.0
1001,Шекспир,"Труд, который нам приятен, излечивает горе.",7.0
1002,Шекспир,"Уж лучше грешным быть, чем грешным слыть.",7.0
1003,Шекспир,"Тревоги дня не облегчает ночь,
А ночь, как день, томит меня тоскою.",7.0
1004,Шекспир,"И я умолк подобно соловью:
Своё пропел и больше не пою.",7.0
1005,Шекспир,"Or, if they sleep, thy picture in my sight
Awakes my heart to heart’s and eye’s delight.
И даже если сплю, твой образ дивный
Чарует взор и сердце непрерывно.",7.0
1006,Шекспир,Немые бриллианты часто действуют на женский ум сильнее всякого красноречия.,7.0
1007,Шекспир,"И всё ж рисует глаз лишь то, что видит он, —
А душу познавать возможности лишён!",7.0
1008,Шекспир,"Если бы все те, у кого строптивые жены, дошли до отчаяния, то десятая часть человечества повесилась бы.",7.0
1009,Шекспир,"Наша жизнь — одна бродячая тень, жалкий актер, который кичится какой-нибудь час на сцене, а там пропадает без вести; сказка, рассказанная безумцем, полная звуков и ярости и не имеющая никакого смысла.",7.0
1010,Шекспир,"Одно из прекраснейших утешений, которые предлагает нам жизнь, — то, что человек не может искренне пытаться помочь другому, не помогая самому себе.",7.0
1011,Шекспир,"Хороша любовь искомая, ещё лучше — рождающаяся без исканий.",7.0
1012,Шекспир,"Нам говорит согласье струн в концерте,
Что одинокий путь подобен смерти.",7.0
1013,Шекспир,"Кто светит, тот и видеть лучше будет.",7.0
1014,Шекспир,"Какая странная судьба, что мы всего более грешим именно тогда, когда слишком благодетельствуем другим.",7.0
1015,Шекспир,"Маленькие люди становятся великими, когда великие переводятся.",7.0
1016,Шекспир,Непрошеные гости зачастую приятны только по уходу.,7.0
1017,Шекспир,"Я слышу сердце друга моего,
А всё кругом беззвучно и мертво.",7.0
1018,Шекспир,"But why thy odour matcheth not thy show,
The soil is this, that thou dost common grow.",7.0
1019,Шекспир,"Зачем же вид и сущность так различны?
Да потому, что ты — цветок публичный.",7.0
1020,Шекспир,"Болезнью шутит тот, кто ран не ведал.",7.0
1021,Шекспир,Глупость служит уму точилом.,7.0
1022,Шекспир,Не знает юность совести упреков.,7.0
1023,Булгаков,"Успевает всюду тот, кто никуда не торопится.",8.0
1024,Булгаков,"Это не стыдно, что я так хочу жить, хотя бы слепым.",8.0
1025,Булгаков,"Писатель всегда будет в оппозиции к политике, пока сама политика будет в оппозиции к культуре.",8.0
1026,Булгаков,"Свежесть бывает только одна — первая, она же и последняя. А если осетрина второй свежести, то это означает, что она тухлая.",8.0
1027,Булгаков,В Москве считают только на сотни тысяч и миллионы.,8.0
1028,Булгаков,"Что-то недоброе таится в мужчинах, избегающих вина, игр, общества прелестных женщин, застольной беседы. Такие люди или тяжело больны, или втайне ненавидят окружающих. Правда, возможны исключения.",8.0
1029,Булгаков,"Вот, что получается, когда исследователь вместо того, чтобы идти параллельно и ощупью с природой, форсирует вопрос и приподнимает завесу: на, получай Шарикова и ешь его с кашей.",8.0
1030,Булгаков,"Умные люди на то и умны, чтобы разбираться в запутанных вещах.",8.0
1031,Булгаков,"Тот, кто любит, должен разделять участь того, кого он любит.",8.0
