,name,quote,auth_id
505,Маяковский,"Надо ставить себе задачи выше своих сил: во-первых, потому, что их всё равно никогда не знаешь, а во-вторых, потому, что силы и появляются по мере выполнения недостижимой задачи.",3.0
506,Маяковский,"Я не люблю людей, безразличных к истине.",3.0
507,Маяковский,«Как хорошо на свете! — подумал он. — Но почему от этого всегда так больно?»,3.0
508,Маяковский,"Все люди, посланные нам — это наше отражение. И посланы они для того, чтобы мы, смотря на этих людей, исправляли свои ошибки, и когда мы их исправляем, эти люди либо тоже меняются, либо уходят из нашей жизни.",3.0
509,Маяковский,"Спасение не в верности формам, а в освобождении от них.",3.0
510,Маяковский,"С кем протекли его боренья? С самим собой, с самим собой.",3.0
511,Маяковский,"Быть женщиной — великий шаг,
Сводить с ума — геройство.",3.0
512,Маяковский,"Вот хомут, вот дуга, я те больше не слуга.",3.0
513,Маяковский,Неуместно и несвоевременно только самое великое.,3.0
514,Маяковский,"Главной бедою, корнем будущего зла была утрата веры в цену собственного мнения.",3.0
515,Маяковский,"Все нынешней весной особое,
Живее воробьёв шумиха.
Я даже выразить не пробую,
Как на душе светло и тихо.",3.0
516,Маяковский,"Им стараешься добро, а они норовят тебе нож в ребро.",3.0
517,Маяковский,"Будущее — это худшая из всех абстракций. Будущее никогда не приходит таким, каким его ждешь.",3.0
518,Маяковский,"Я знал двух влюблённых, живших в Петрограде в дни революции и не заметивших её.",3.0
519,Маяковский,"Принадлежность к типу есть конец человека, его осуждение.",3.0
520,Маяковский,"Попадаются люди с талантом. Но сейчас очень в ходу разные кружки и объединения. Всякая стадность — прибежище неодарённости, всё равно верность ли это Соловьёву, или Канту, или Марксу. Истину ищут только одиночки и порывают со всеми, кто любит её недостаточно.",3.0
521,Маяковский,Февраль. Достать чернил и плакать!,3.0
522,Маяковский,Стихи Бориса Пастернака,3.0
523,Маяковский,Силу подлости и злобы одолеет дух добра.,3.0
524,Маяковский,"Предмет нашего обожания тем больше кажется нам жертвою, чем более мы его любим.",3.0
525,Маяковский,"Человек рождается жить, а не готовиться к жизни.",3.0
526,Маяковский,"Надо ставить себе задачи выше своих сил: во-первых, потому, что их всё равно никогда не знаешь, а во-вторых, потому, что силы и появляются по мере выполнения недостижимой задачи.",3.0
527,Маяковский,"Я не люблю людей, безразличных к истине.",3.0
528,Маяковский,«Как хорошо на свете! — подумал он. — Но почему от этого всегда так больно?»,3.0
529,Маяковский,"Все люди, посланные нам — это наше отражение. И посланы они для того, чтобы мы, смотря на этих людей, исправляли свои ошибки, и когда мы их исправляем, эти люди либо тоже меняются, либо уходят из нашей жизни.",3.0
530,Маяковский,"Спасение не в верности формам, а в освобождении от них.",3.0
531,Маяковский,"С кем протекли его боренья? С самим собой, с самим собой.",3.0
532,Маяковский,"Быть женщиной — великий шаг,
Сводить с ума — геройство.",3.0
533,Маяковский,"Вот хомут, вот дуга, я те больше не слуга.",3.0
534,Маяковский,Неуместно и несвоевременно только самое великое.,3.0
535,Маяковский,"Главной бедою, корнем будущего зла была утрата веры в цену собственного мнения.",3.0
536,Маяковский,"Все нынешней весной особое,
Живее воробьёв шумиха.
Я даже выразить не пробую,
Как на душе светло и тихо.",3.0
537,Маяковский,"Им стараешься добро, а они норовят тебе нож в ребро.",3.0
538,Маяковский,"Будущее — это худшая из всех абстракций. Будущее никогда не приходит таким, каким его ждешь.",3.0
539,Маяковский,"Я знал двух влюблённых, живших в Петрограде в дни революции и не заметивших её.",3.0
540,Маяковский,"Принадлежность к типу есть конец человека, его осуждение.",3.0
541,Маяковский,"Попадаются люди с талантом. Но сейчас очень в ходу разные кружки и объединения. Всякая стадность — прибежище неодарённости, всё равно верность ли это Соловьёву, или Канту, или Марксу. Истину ищут только одиночки и порывают со всеми, кто любит её недостаточно.",3.0
542,Маяковский,Февраль. Достать чернил и плакать!,3.0
543,Маяковский,Стихи Бориса Пастернака,3.0
544,Маяковский,Силу подлости и злобы одолеет дух добра.,3.0
545,Маяковский,"Предмет нашего обожания тем больше кажется нам жертвою, чем более мы его любим.",3.0
546,Маяковский,"Человек рождается жить, а не готовиться к жизни.",3.0
547,Маяковский,"Надо ставить себе задачи выше своих сил: во-первых, потому, что их всё равно никогда не знаешь, а во-вторых, потому, что силы и появляются по мере выполнения недостижимой задачи.",3.0
548,Маяковский,"Я не люблю людей, безразличных к истине.",3.0
549,Маяковский,«Как хорошо на свете! — подумал он. — Но почему от этого всегда так больно?»,3.0
550,Маяковский,"Все люди, посланные нам — это наше отражение. И посланы они для того, чтобы мы, смотря на этих людей, исправляли свои ошибки, и когда мы их исправляем, эти люди либо тоже меняются, либо уходят из нашей жизни.",3.0
551,Маяковский,"Спасение не в верности формам, а в освобождении от них.",3.0
552,Маяковский,"С кем протекли его боренья? С самим собой, с самим собой.",3.0
553,Маяковский,"Быть женщиной — великий шаг,
Сводить с ума — геройство.",3.0
554,Маяковский,"Вот хомут, вот дуга, я те больше не слуга.",3.0
555,Маяковский,Неуместно и несвоевременно только самое великое.,3.0
556,Маяковский,"Главной бедою, корнем будущего зла была утрата веры в цену собственного мнения.",3.0
557,Маяковский,"Все нынешней весной особое,
Живее воробьёв шумиха.
Я даже выразить не пробую,
Как на душе светло и тихо.",3.0
558,Маяковский,"Им стараешься добро, а они норовят тебе нож в ребро.",3.0
559,Маяковский,"Будущее — это худшая из всех абстракций. Будущее никогда не приходит таким, каким его ждешь.",3.0
560,Маяковский,"Я знал двух влюблённых, живших в Петрограде в дни революции и не заметивших её.",3.0
561,Маяковский,"Принадлежность к типу есть конец человека, его осуждение.",3.0
562,Маяковский,"Попадаются люди с талантом. Но сейчас очень в ходу разные кружки и объединения. Всякая стадность — прибежище неодарённости, всё равно верность ли это Соловьёву, или Канту, или Марксу. Истину ищут только одиночки и порывают со всеми, кто любит её недостаточно.",3.0
563,Маяковский,Февраль. Достать чернил и плакать!,3.0
564,Высоцкий,Но даже светлые умы все размещают между строк: у них расчет на долгий срок. ,4.0
565,Высоцкий,"Коридоры кончаются стенкой, а тоннели выводят на свет.",4.0
566,Высоцкий,"Несколько раз я уже похоронен, несколько раз уехал, несколько раз отсидел, причем такие сроки, что еще лет сто надо прожить. Одна девочка из Новосибирска меня спросила: «Правда, что вы умерли?» Я говорю: «Не знаю». ",4.0
567,Высоцкий,"Утро вечера мудренее, но и в вечере что–то есть. ",4.0
568,Высоцкий,Альпинизм — это прекрасный способ перезимовать летом. ,4.0
569,Высоцкий,"Вот уж действительно, все относительно — все, все, все…",4.0
570,Высоцкий,"Какие странные дела, у нас в России лепятся!",4.0
571,Высоцкий,"Шестым чувством своим, всем существом, всем данным господом богом разумом уверен я, что нормален. Но, увы! Убедить в этом невозможно, да и стоит ли?! ",4.0
572,Высоцкий,"Нас всегда заменяют другими, чтобы мы не мешали вранью.",4.0
573,Высоцкий,"Вот моя последняя записка: «Я много работал! Прошу не будить! Никогда. Засыпаю насовсем. Люди, я любил вас! Будьте снисходительны!» ",4.0
574,Высоцкий,"Наши мертвые нас не оставят в беде, наши павшие — как часовые.",4.0
575,Высоцкий,"Спасибо вам светители, что плюнули да дунули, что вдруг мои родители зачать меня задумали…",4.0
576,Высоцкий,"Если отвернутся, значит недостаточно любили. ",4.0
577,Высоцкий,"С меня при цифре 37 в момент слетает хмель. Вот и сейчас как холодом подуло, под эту цифру Пушкин подгадал себе дуэль и Маяковский лег виском на дуло.",4.0
578,Высоцкий,"У братских могил нет заплаканных вдов — сюда ходят люди покрепче, на братских могилах не ставят крестов. Но разве от этого легче?",4.0
579,Высоцкий,"Утро мудренее! Но и утром все не так, нет того веселья: или куришь натощак, или пьёшь с похмелья.",4.0
580,Высоцкий,"Если б водка была на одного — как чудесно бы было! Но всегда покурить — на двоих, но всегда распивать — на троих. Что же на одного? На одного — колыбель и могила. ",4.0
581,Высоцкий,"Наше время иное, лихое, но счастье как встарь, ищи! И в погоню летим мы за ним, убегающим вслед. Только вот в этой скачке теряем мы лучших товарищей, на скаку не заметив, что рядом — товарищей нет.",4.0
582,Высоцкий,"Даже падать свободно нельзя, потому, что мы падаем не в пустоте. ",4.0
583,Высоцкий,"Украду, если кража тебе по душе — зря ли я столько сил разбазарил?! Соглашайся хотя бы на рай в шалаше, если терем с дворцом кто-то занял!",4.0
584,Высоцкий,"Толка нет от мыслей и наук, когда повсюду — им опроверженье. ",4.0
585,Высоцкий,"Ты, Зин, на грубость нарываешься,
Всё, Зин, обидеть норовишь!
Тут за день так накувыркаешься…
Придёшь домой — там ты сидишь!",4.0
586,Высоцкий,"Мне есть что спеть, представ перед Всевышним. ",4.0
587,Высоцкий,"Сколько слухов наши уши поражает, сколько сплетен разъедает, словно моль.",4.0
588,Высоцкий,"Надо, надо сыпать соль на раны, чтоб лучше помнить, пусть они болят. ",4.0
589,Высоцкий,"Все жили вровень, скромно так: система коридорная, на тридцать восемь комнаток всего одна уборная. Здесь на зуб зуб не попадал, не грела телогреечка, здесь я доподленно узнал, по чём она копеечка.",4.0
590,Высоцкий,"Когда я вижу сломанные крылья, нет жалости во мне, и неспроста: я не люблю насилье и бессилье, вот только жаль распятого Христа.",4.0
591,Высоцкий,"Лучше гор могут быть только горы, На которых еще не бывал. ",4.0
592,Высоцкий,"И нас хотя расстрелы не косили, но жили мы поднять не смея глаз, — мы тоже дети страшных лет России, безвременье вливало водку в нас.",4.0
593,Высоцкий,"Ведь Земля — это наша душа, сапогами не вытоптать душу!",4.0
594,Высоцкий,"Ясновидцев — впрочем, как и очевидцев — во все века сжигали люди на кострах. ",4.0
595,Высоцкий,"Будут с водкою дебаты, — отвечай: «Нет, ребята-демократы, — только чай!»",4.0
596,Высоцкий,"Убиенных щадят, отпевают и балуют раем, не скажу про живых, но покойников мы бережем. ",4.0
597,Высоцкий,"Ходишь — озираешься,
И ловишь каждый взгляд, —
Малость зазеваешься —
Уже тебя едят!",4.0
598,Высоцкий,"… любовь – это вечно любовь,
Даже в будущем вашем далёком.",4.0
599,Высоцкий,"Я думаю — ученые наврали, прокол у них в теории, порез: развитие идет не по спирали, а вкривь и вкось, вразнос, наперерез. ",4.0
600,Высоцкий,"Если не любил — Значит, и не жил, и не дышал! ",4.0
601,Высоцкий,Я согласен бегать в табуне — Но не под седлом и без узды! ,4.0
602,Высоцкий,"Я уважаю вообще все профессии, если человек в них профессионал.",4.0
603,Высоцкий,Мы успели: В гости к Богу — не бывает опозданий. ,4.0
604,Высоцкий,"Нервы у меня хотя луженые,
Кончилось спокойствие навеки.
Эх, вы мои нервы обнажённые!
Ожили б — ходили б как калеки.",4.0
605,Высоцкий,"— Что вы цените в мужчинах?
— Сочетание доброты, силы и ума. Я когда надписываю фотографии пацанам, обязательно пишу: «Вырасти сильным, умным и добрым». Вот такое сочетание.",4.0
606,Высоцкий,"Зачем мне быть душою общества, когда души в нем вовсе нет!",4.0
607,Высоцкий,Маски равнодушья у иных — защита от плевков и от пощечин. ,4.0
608,Высоцкий,"— Недостаток, который вы не прощаете?
— Их много. Я не хочу перечислять, но… Жадность. Отсутствие позиции, которое ведет за собой очень много других пороков. Когда человек сам не знает — не только, чего он хочет в этой жизни, а когда он не имеет своего мнения или не может рассудить о предмете, о людях, о смысле жизни — да о чем угодно! — сам, самостоятельно. Когда он либо повторяет то, что ему когда-то понравилось, чему его научили, либо неспособен к самостоятельному мышлению.",4.0
609,Высоцкий,Настоящих буйных мало — вот и нету вожаков. ,4.0
610,Высоцкий,"Слухи по России верховодят и со сплетней в терции поют. Ну а где-то рядом с ними ходит правда, на которую плюют. ",4.0
611,Высоцкий,"Подымайте руки, в урны суйте бюллетени, даже не читав, — помереть от скуки! Голосуйте, только, чур, меня не приплюсуйте: Я не разделяю ваш Устав!",4.0
612,Высоцкий,"Я не люблю уверенности сытой, уж лучше пусть откажут тормоза. Досадно мне, коль слово «честь» забыто и коль в чести наветы за глаза.",4.0
613,Высоцкий,"Слова бегут им тесно — ну и что же! — ты никогда не бойся опоздать. Их много — слов, но все же если можешь — скажи, когда не можешь не сказать. ",4.0
614,Высоцкий,"Я думаю — ученые наврали, — прокол у них в теории, порез: развитие идет не по спирали, а вкривь и вкось, вразнос, наперерез.",4.0
615,Высоцкий,"Каждый волхвов покарать норовит, а нет бы — послушаться, правда? ",4.0
616,Высоцкий,"… Иногда напишешь песню и вдруг видишь: сам ведешь себя несоответственно. Вот, например, после того как я написал «Балладу о переселении душ», стал приглядываться к собакам. Думаю: а вдруг это какой-нибудь бродячий музыкант раньше был? Или там кошек каких-нибудь видишь, думаешь, что это какие-нибудь дамы раньше были, определенные. И уже с ними ведешь себя по-другому…",4.0
617,Высоцкий,"Лучше жить 40 лет на коне, чем без щита.",4.0
618,Высоцкий,"Счастье — это путешествие, необязательно из мира в мир… Это путешествие может быть в душу другого человека, путешествие в мир писателя или поэта… И не одному, а с человеком, которого ты любишь. Может быть, какие-то поездки, но вдвоем с человеком, которого ты любишь, мнением которого ты дорожишь.",4.0
619,Высоцкий,"Только голодовка может убедить вас в том, что личность — это не тлеющая тварь, а нечто даже значительно большее. ",4.0
620,Высоцкий,"… Но в виски, как в барабаны,
Бьётся память, рвётся в бой.",4.0
621,Высоцкий,"А вы знаете, как поп попадью извел? Что значит извел? Убил, то есть. Ну! Развод по-итальянски. Вот. Он ее подкараулил и спустил на нее икону Спасителя. Тройной эффект. Во-первых, если уж Спаситель не спас, а убил, значит, было за что. ",4.0
622,Высоцкий,"Фартило мне, Земля вертелась,
И, взявши пары три белья,
Я шасть туда. Но вмиг хотелось
Назад, откуда прибыл я.",4.0
623,Высоцкий,"У меня есть претензии к властям моей страны, но решать я их буду не с вами.",4.0
624,Высоцкий,"Все пророки — и Иоанн, и Исаак, и Соломон, и Моисей, и еще кто-то — правы только в одном, что жил Господь, распнули его, воскрес он и ныне здравствует, царство ему небесное. А все другое, насчет возлюбления ближнего, подставления щек под удары оных, а так же — не забижай, не смотри, не слушай, не дыши, когда не просят, и прочая чушь — все это добавили из устного народного творчества. Да, вот еще: «не убий!» — это правильно. Не надо убивать. Убивать жалко, да и не за что. ",4.0
625,Высоцкий,"Я отвечаю за свое творчество перед страной, которая поет и слушает мои песни, несмотря на то, что их не пропагандируют ни радио, ни телевидение, ни концертные организации.",4.0
626,Высоцкий,"Никогда не суди с первого взгляда ни о собаке, ни о человеке. Потому что, простая дворняга может иметь добрейшую душу, а человек приятной наружности может оказаться редкой сволочью.",4.0
